{
  "schema_version": "hdp.ahrq-release-probe.v1",
  "record_type": "ahrq_release_probe",
  "fixture_id": "fixture:ahrq:official-release-unchanged",
  "source_id": "source:ahrq:lighthouse",
  "source_url": "https://example.gov/ahrq/release.json",
  "probe_state": "release_metadata",
  "release_metadata": {
    "source_id": "source:ahrq:lighthouse",
    "source_url": "https://example.gov/ahrq/release.json",
    "release_id": "release:ahrq:2026-08-22",
    "release_label": "AHRQ official hospital release 2026-08-22",
    "published_at": "2026-08-22T00:00:00Z"
  },
  "response_body": "{\n  \"release_id\": \"release:ahrq:2026-08-22\",\n  \"release_label\": \"AHRQ official hospital release 2026-08-22\",\n  \"published_at\": \"2026-08-22T00:00:00Z\",\n  \"download_url\": \"https://example.gov/ahrq/hospitals-2026-08-22.json\"\n}"
}
